[
  {
    "id": "40109396-2ee4-49ae-8290-2f435fd88c5e",
    "name": "Mule",
    "source": "Salvage Union Workshop Manual",
    "page": 100,
    "asset_url": "https://opxrguskxuogghzcnppk.supabase.co/storage/v1/object/public/LP-Assets/chassis/mule.png",
    "patterns": [
      {
        "name": "Hauler Pattern",
        "legalStarting": true,
        "systems": [
          {
            "name": ".50 Cal Machine Gun"
          },
          {
            "name": "Escape Hatch"
          },
          {
            "name": "Floodlights"
          },
          {
            "name": "Locomotion System"
          },
          {
            "name": "Loudspeakers"
          },
          {
            "name": "Rigging Arm"
          },
          {
            "name": "Transport Hold"
          }
        ],
        "modules": [
          {
            "name": "Comms Module"
          },
          {
            "name": "Reactor Flare"
          }
        ],
        "content": [
          {
            "type": "paragraph",
            "value": "This Mule, favoured by wastelanders and traders alike, is designed for hauling cargo, whilst being armed with some rudimentary defences."
          }
        ]
      },
      {
        "name": "Crusher Pattern",
        "systems": [
          {
            "name": "Red Laser"
          },
          {
            "name": "Dozer Blades"
          },
          {
            "name": "Escape Hatch"
          },
          {
            "name": "Hydraulic Crusher"
          },
          {
            "name": "Locomotion System"
          },
          {
            "name": "Loudspeakers"
          },
          {
            "name": "Rigging Arm"
          }
        ],
        "modules": [
          {
            "name": "Comms Module"
          },
          {
            "name": "Survey Scanner"
          }
        ],
        "content": [
          {
            "type": "paragraph",
            "value": "Clean and simple, this Mule can salvage Scrap, haul it back to a Crawler or wasteland settlement, and defend itself in a pinch from any raiders."
          }
        ]
      },
      {
        "name": "Evantis Pattern",
        "systems": [
          {
            "name": "Missile Pod"
          },
          {
            "name": "Armour Plating"
          },
          {
            "name": "Composite Armour"
          },
          {
            "name": "Ejection System"
          },
          {
            "name": "Locomotion System"
          }
        ],
        "modules": [
          {
            "name": "Comms Module"
          },
          {
            "name": "Laser Guidance"
          }
        ],
        "content": [
          {
            "type": "paragraph",
            "value": "These heavily armed and armoured Mules were used extensively during the Second Corpo War, to ferry cargo between arcos. Many salvager raids were rebuffed by corpos 'Circling the Mules' to create a devastating ring of missile fire."
          }
        ]
      },
      {
        "name": "Acid Spitter Mule",
        "systems": [
          {
            "name": "Acid Cannon"
          },
          {
            "name": "Rigging Arm"
          },
          {
            "name": "Escape Hatch"
          },
          {
            "name": "Locomotion System"
          }
        ],
        "modules": [
          {
            "name": "Comms Module"
          },
          {
            "name": "Olfactory Glands"
          }
        ],
        "content": [
          {
            "type": "paragraph",
            "value": "Mules fitted with acid spitters to defend their Bio-Salvage hauls in Gehenna."
          }
        ]
      }
    ],
    "structurePoints": 12,
    "energyPoints": 4,
    "heatCapacity": 6,
    "systemSlots": 16,
    "moduleSlots": 2,
    "cargoCapacity": 16,
    "techLevel": 1,
    "salvageValue": 7,
    "content": [
      {
        "type": "paragraph",
        "value": "The 'M-63' Mule was developed by the Opus Institute as one of the first open source Mech blueprints. They remain a ubiquitous presence across the wasteland as a result. Their design was replicated not only by other corpos, but numerous enthusiasts with a crafting bay. The Mule's spacious cargo bay makes the Mech invaluable to wastelanders, corpos, and salvagers alike for transporting salvage over a wide array of terrain, whilst its general hardiness allows it to survive numerous threats from raider ambushes to radiation storms."
      }
    ],
    "chassisAbilities": [
      "Integrated Cargo Bay"
    ]
  },
  {
    "id": "df6b7872-5fbe-4602-b564-564157864746",
    "name": "Mazona",
    "source": "Salvage Union Workshop Manual",
    "page": 102,
    "asset_url": "https://opxrguskxuogghzcnppk.supabase.co/storage/v1/object/public/LP-Assets/chassis/mazona.png",
    "patterns": [
      {
        "name": "Buzzard Pattern",
        "legalStarting": true,
        "systems": [
          {
            "name": "FM-3 Flamethrower",
            "count": 2
          },
          {
            "name": "Loudspeakers"
          }
        ],
        "modules": [
          {
            "name": "Comms Module"
          },
          {
            "name": "Self-Destruct"
          },
          {
            "name": "Weapon Link"
          }
        ],
        "content": [
          {
            "type": "paragraph",
            "value": "Buzzards of the wastes, raiders relish these builds as it lets them overheat larger Mechs whilst stripping the flesh off of anything else."
          }
        ]
      },
      {
        "name": "Scrap Flinger Pattern",
        "systems": [
          {
            "name": "Mechapult"
          },
          {
            "name": "Escape Hatch"
          },
          {
            "name": "Loudspeakers"
          }
        ],
        "modules": [
          {
            "name": "Comms Module"
          },
          {
            "name": "Metal Detector"
          },
          {
            "name": "Pinpoint Targeter"
          }
        ],
        "content": [
          {
            "type": "paragraph",
            "value": "This is not the most orthodox platform for a Mechapult, but who am I to stop you?"
          }
        ]
      },
      {
        "name": "Stefanus Pattern",
        "systems": [
          {
            "name": "Rigging Arm"
          },
          {
            "name": "Smuggling Hold"
          }
        ],
        "modules": [
          {
            "name": "Comms Tapper"
          },
          {
            "name": "Eggs Mayhem"
          },
          {
            "name": "Reactor Overload"
          }
        ],
        "content": [
          {
            "type": "paragraph",
            "value": "Designed for smuggling and covert reconnaissance, being disguised as a delivery drone allows it to blend into the background within most arcos and settlements undetected."
          }
        ]
      }
    ],
    "structurePoints": 5,
    "energyPoints": 10,
    "heatCapacity": 6,
    "systemSlots": 7,
    "moduleSlots": 3,
    "cargoCapacity": 6,
    "techLevel": 1,
    "salvageValue": 4,
    "content": [
      {
        "type": "paragraph",
        "value": "The Mazona 'PR1-M3' was created by DronTek Systems in the aftermath of the first Luddite Rebellion. It was designed as a delivery drone that could be piloted by a worker rather than automated. Its design remains useful due to the majority of automated drones malfunctioning as a result of the increased radiation storms across the wastelands. Whilst fragile, the DronTek patented hover function enables it to operate across a wide variety of terrain, plus it is a cheap Mech to rebuild if it does get blown apart."
      }
    ],
    "chassisAbilities": [
      "Hover Drone"
    ]
  },
  {
    "id": "105055e2-eb07-4329-8dc0-a344d6d77212",
    "name": "Scrapper",
    "source": "Salvage Union Workshop Manual",
    "page": 104,
    "asset_url": "https://opxrguskxuogghzcnppk.supabase.co/storage/v1/object/public/LP-Assets/chassis/scrapper.png",
    "patterns": [
      {
        "name": "Leaky Pattern",
        "legalStarting": true,
        "systems": [
          {
            "name": "Chainsaw Arm"
          },
          {
            "name": "Escape Hatch"
          },
          {
            "name": "Locomotion System"
          },
          {
            "name": "Riveting Gun"
          },
          {
            "name": "Rigging Arm"
          }
        ],
        "modules": [
          {
            "name": "Comms Module"
          },
          {
            "name": "Personal Recreation Device"
          }
        ],
        "content": [
          {
            "type": "paragraph",
            "value": "The wasteland Scrapper is vital for survival, allowing repair, defence, and maintenance of a waster settlement even in the harshest of conditions."
          }
        ]
      },
      {
        "name": "Rigger Pattern",
        "systems": [
          {
            "name": "Hydraulic Crusher"
          },
          {
            "name": "Escape Hatch"
          },
          {
            "name": "Locomotion System"
          },
          {
            "name": "Transport Hold"
          },
          {
            "name": "Welding Laser"
          }
        ],
        "modules": [
          {
            "name": "Comms Module"
          },
          {
            "name": "Survey Scanner"
          }
        ],
        "content": [
          {
            "type": "paragraph",
            "value": "This salvager favoured pattern is built for heavy salvage and repair operations in dangerous conditions."
          }
        ]
      },
      {
        "name": "Sakura Pattern",
        "systems": [
          {
            "name": "Articulated Rigging Arm"
          },
          {
            "name": "Escape Hatch"
          },
          {
            "name": "Floodlights"
          },
          {
            "name": "High Pressure Hose"
          },